slice,label_1,score_1,label_2,score_2,label_3,score_3,label_4,score_4,label_5,score_5,label_6,score_6,label_7,score_7,label_8,score_8,label_9,score_9,label_10,score_10,label_11,score_11,label_12,score_12,label_13,score_13,label_14,score_14,label_15,score_15,label_16,score_16,label_17,score_17,label_18,score_18,label_19,score_19,label_20,score_20,label_21,score_21,label_22,score_22,label_23,score_23,label_24,score_24,label_25,score_25,label_26,score_26,label_27,score_27,label_28,score_28,label_29,score_29,label_30,score_30,label_31,score_31,label_32,score_32,label_33,score_33,label_34,score_34,label_35,score_35,label_36,score_36,label_37,score_37,label_38,score_38,label_39,score_39,label_40,score_40,label_41,score_41,label_42,score_42,label_43,score_43,label_44,score_44,label_45,score_45,label_46,score_46,label_47,score_47,label_48,score_48,label_49,score_49,label_50,score_50,label_51,score_51,label_52,score_52,label_53,score_53,label_54,score_54,label_55,score_55,label_56,score_56,label_57,score_57,label_58,score_58,label_59,score_59,label_60,score_60,label_61,score_61,label_62,score_62,label_63,score_63,label_64,score_64,label_65,score_65,label_66,score_66,label_67,score_67,label_68,score_68,label_69,score_69,label_70,score_70,label_71,score_71,label_72,score_72,label_73,score_73,label_74,score_74,label_75,score_75,label_76,score_76,label_77,score_77,label_78,score_78,label_79,score_79,label_80,score_80,label_81,score_81,label_82,score_82,label_83,score_83,label_84,score_84,label_85,score_85,label_86,score_86,label_87,score_87,label_88,score_88,label_89,score_89,label_90,score_90,label_91,score_91,label_92,score_92,label_93,score_93,label_94,score_94,label_95,score_95,label_96,score_96,label_97,score_97,label_98,score_98,label_99,score_99,label_100,score_100
slice_000_032.npy,Happy New Year!,79.76422,I will have coffee after I eat.,78.93884,fruit dish,78.92728,We have a test tomorrow.,78.71149,What is the soup of the day?,78.535675,Where can I find a job centre?,78.502365,Can I offer you anything to drink?,78.287155,Independent project,78.126755,May I introduce my wife?,78.07959,unleavened bread,78.06054,fruit salad,78.009254,I was Born in 1960.,77.91379,Where is an exchange office?,77.815125,What are today's specials?,77.798744,Can I offer you anything to eat?,77.77819,Will you be dining in today?,77.57851,From what time is it open?,77.52454,baby formula,77.51888,job offer,77.51231,May I introduce my son?,77.48413,The baby is cute.,77.40489,I hope you will like it in our house.,77.39806,underground economy,77.357994,Do you want your eggs scrambled dry?,77.32819,My husband had an operation.,77.32542,"Lovely day today, isn't it?",77.30426,parental benefit during pregnancy,77.2785,sour cream,77.26672,Where were you born?,77.25648,Our music is modern.,77.232834,My mother works as a clerk in an office.,77.212845,May I introduce my daughter?,77.13585,I want to tell you something about my family.,77.095505,interactive toy,77.073555,What time does the bus arrive?,76.99385,"Hello, can I help you?",76.93752,When were you born?,76.866196,Give me a new chance.,76.861435,What time does the post office close?,76.84397,baby toy,76.77518,You have a big alcohol problem.,76.76605,I got an email from my mother today.,76.73639,baby spoon,76.71409,kitchen paper,76.71133,Where is the nearest post office?,76.702576,Boy scouts is a good organization.,76.6809,corporate income tax,76.64464,Happy Thanksgiving!,76.61178,What's your social security number?,76.580894,this year,76.54854,What does it eat?,76.505,Will we play at the same table?,76.50192,job mediation,76.484375,participation in labour market,76.44828,birth announcement,76.41757,Christmas present,76.417046,Where is the tourist information office?,76.41029,Our church is having a revival.,76.40048,economic efficiency,76.35498,community center,76.34079,marriage counselling,76.33948,speech and language therapy,76.30382,benefits package,76.239334,family benefit,76.21904,Breakfast is not served after 11 am,76.210655,Where are your boyfriend?,76.190186,self-initiated project,76.182205,I will have hot tea.,76.15694,parental consent,76.14782,void contract,76.14505,Where is the next bus stop?,76.138756,The bacon is overdone.,76.13068,What is the date today?,76.06816,baby pacifier,76.0497,I was born deaf.,76.0469,unemployment benefit fund,76.039764,association grants,76.029686,May I introduce my friend?,76.00638,cash economy,76.00513,after school care club,76.00148,social economy,75.96013,I can't eat the whole thing.,75.95514,supported employment,75.95239,Happy Valentines Day!,75.93118,employment office,75.91888,You mustn't eat anything.,75.90659,Which city is the capital?,75.841965,I'm answering an advertisement.,75.84093,community work,75.84026,to have supper,75.830666,I got a new computer for my birthday.,75.8178,playroom,75.80995,job interview,75.795456,free school meal,75.794075,birth parent,75.75743,Do you want your eggs scrambled wet?,75.75494,fruit seller,75.75392,group work,75.74368,Where is the teater?,75.73013,soft egg,75.71614
slice_032_064.npy,seagull,78.441956,red bean,78.24565,red tea,77.87014,bird of prey,77.82219,rubber stamp,77.70163,I don't earn enough money.,77.542984,birdbath,77.36751,yawn,77.096245,poisonous mushroom,76.968254,lament,76.90856,bird cherry,76.85151,My mother works as a clerk in an office.,76.72738,school bullying,76.69724,chicken,76.164795,My bird is ill.,76.160446,grass snake,76.008545,I am too old.,75.86641,false teeth,75.846954,dimple,75.83285,Chicken Little,75.75417,lame,75.64354,riding school,75.64283,black grouse,75.54983,custard apple,75.4961,cornflower,75.45526,red fruit tea,75.44936,The Princess and the Frog,75.4218,the Upper Secondary School Ordinance,75.35588,renounce,75.336075,break a promise,75.27894,tongue depressor,75.26276,submarine,75.238914,candle snuffer,75.149574,redcurrant,75.14679,I'm answering an advertisement.,75.1439,sore throat,75.08446,hoarse,75.064835,tree frog,75.04826,I lost my pencil.,75.03801,hazel grouse,75.00086,water ski,74.98259,The elevator is stuck.,74.9514,dry cough,74.906784,I have a sore throat.,74.85324,I got an 'E' on my paper.,74.83758,warbler,74.83747,simple lipid,74.83419,thermal underwear,74.82411,rodent,74.77982,edible fungi,74.76696,greenfly,74.74436,Stick your tongue out.,74.70943,Daisy Duck,74.69066,the principle of public access to official documents,74.64168,paper airplane,74.62901,caught red-handed,74.59546,forecast error,74.572914,weasel,74.55565,seahorse,74.52078,growl,74.474075,chuckle,74.473854,strep throat,74.441086,frog planter,74.42502,I got a 'A' on my paper.,74.41669,I‘m looking for a job.,74.39956,sparrow,74.369896,cold turkey,74.35347,The Little Mermaid,74.311005,cotton candy,74.29036,I am interested in working for your company.,74.287735,I got a 'D' on my paper.,74.28357,rural municipality district,74.28112,apple tree,74.24808,dragonfly,74.21901,confidence region,74.19312,mouth closed,74.14523,One of my hobbies is writing letters to my pen-friends.,74.13962,barn swallow,74.13912,water-cooled,74.09291,robin,74.07827,My Little Pony,74.06398,I got a 'B' on my paper.,74.02482,red cabbage,74.01605,I like my work.,74.01554,age limit,74.01106,orange,73.96673,job interview,73.962585,I am applying for a credit card.,73.9382,mature,73.936676,collinear,73.93477,peach tree,73.91096,fang,73.902695,I graduate in two years.,73.88334,I got a 'F' on my paper.,73.87558,school year,73.84488,I am an actor.,73.80082,I have a cough.,73.78963,snake charmer,73.770615,nature worship,73.76903,I need a shave.,73.74251
slice_064_096.npy,direct speech,78.16796,elections to the European Parliament,76.97546,exact,76.82206,I'd like to go for a hike in the mountains.,76.47088,the Upper Secondary School Ordinance,76.410286,run for office,76.2491,caught red-handed,76.23152,I want to subscribe to a newspaper.,76.0296,flying squirrel,75.674866,false teeth,75.53242,How much does it cost to get to the airport?,75.49263,spot,75.4093,collusion at an auction,75.403404,vicious circle,75.29088,complex,75.24979,siesta,75.20816,the principle of public access to official documents,75.18846,to get somewhere,75.13556,I am interested in working for your company.,75.11849,small ads,75.087944,total depravity,75.06769,jussive mood,75.060555,local elections,75.02214,scandal,75.0062,We must pay taxes to support the government.,75.00119,The temperature is 76 degrees.,74.996414,notice,74.91768,environmental impact,74.91406,mouth closed,74.82999,direct object,74.82461,direct tax,74.76066,compulsory school age,74.72681,"I voted, did you?",74.71281,gender perspective,74.683304,overeating,74.626945,royalty,74.61709,beat around the bush,74.613754,bird of prey,74.53299,squirrel away,74.53182,The temperature is below zero.,74.50921,bit,74.49159,on approval,74.46892,collusion,74.464676,oral sex,74.460724,I went to a school for hearing children.,74.455215,I am too old.,74.447754,old age,74.444275,optimal contract,74.34533,school bullying,74.29128,pupil council,74.27619,The city council will vote this week.,74.27278,absolute zero temperature,74.26854,kilometre per hour,74.19766,You must follow a diet.,74.16164,dry cough,74.1549,With or without pickles?,74.15306,darts,74.14421,You must not interrupt.,74.14041,Are you going to the town council meeting?,74.10336,You have a big alcohol problem.,74.03122,break a promise,73.99242,My mother works as a clerk in an office.,73.967964,fiscal year,73.95474,capture the moment,73.94881,verbal agreement,73.92006,prediction,73.90924,total return,73.90661,We´ll talk on the phone.,73.89139,distance learning,73.87125,ultraviolet,73.84743,nibble,73.845055,fast forward,73.84057,paper airplane,73.78441,backslash,73.76612,How do I get to the airport?,73.744675,I am looking for a laundromat.,73.73498,Math is a difficult subject for me.,73.72136,I do a paper route to earn a little money.,73.693695,inner lips,73.68854,aerosol,73.66788,I have to go home.,73.66684,weather report,73.66522,He talks too much in class.,73.653175,You have to go the library to do some research.,73.63467,I don't earn enough money.,73.61931,I want to tell you something about my family.,73.605804,I'm looking for a room.,73.5902,counter attack,73.58145,hoarse,73.55755,report,73.55575,oral examination,73.55342,school attendance,73.519936,academic year,73.4939,birdbath,73.47901,hard on,73.47012,The teacher asked me a lot of questions.,73.45854,school year,73.453896,accidentally,73.44474,How long would you like to stay at our hotel?,73.42293,make a pitch,73.41475
slice_096_128.npy,April fool,80.8435,absolute zero temperature,80.043724,break a promise,79.520996,the principle of public access to official documents,79.456085,anti-racism,78.984665,cold turkey,78.81499,in love,78.72724,common blackbird,78.70263,alcohol dependence,78.50162,The temperature is below zero.,77.99199,fool,77.81665,I am interested in working for your company.,77.647896,blackmail,77.610016,betray,77.32968,gender perspective,77.29776,denounce,77.24534,arithmetic mean,77.2247,condom,77.22006,condemn,77.198166,Prohibition sign: No open fire,77.11119,Can you read lips?,77.03278,alcoholise,76.95122,alcohol abuse,76.930115,You have a big alcohol problem.,76.81126,keep a secret,76.79385,You must follow a diet.,76.729065,"Excuse me, could you tell me the way to the station, please?",76.673584,collusion,76.66534,The Black Stone,76.61142,deceive,76.59804,Are your parents deaf?,76.58865,It's time to take your temperature.,76.56523,Black Friday,76.536514,Is that enough for you?,76.48307,caught red-handed,76.47063,sentence expressing a doubt,76.34941,Are you a Roman Catholic or a Protestant?,76.337265,I want you to use a condom.,76.27542,false teeth,76.2569,negativity bias,76.21196,taboo word,76.17751,blowout,76.11655,school bullying,76.11311,professional secrecy,76.10078,irony,76.06729,We must pay taxes to support the government.,76.040695,bird feeder with apple skewer,76.03894,deaf activism,76.02301,compulsory school age,75.89573,What is the temperature?,75.85126,direct speech,75.83833,forecast error,75.827866,nature worship,75.825806,The temperature is 76 degrees.,75.80964,collusion at an auction,75.748795,stress tolerance,75.72857,notify,75.70922,simple lipid,75.65755,condemnation,75.6178,eating disorder,75.61695,trick,75.60164,hidden unemployment,75.58393,I am sorry to bother you.,75.5518,direct tax,75.47964,oral sex,75.476875,Are you a member of the church?,75.43344,binary star,75.43248,deaf humour,75.41006,lament,75.37579,impersonal,75.374435,bored,75.35807,If you break the law you might go to jail.,75.33978,bird cherry,75.28799,Can I offer you anything to drink?,75.25469,trigonometry,75.23663,fall in love,75.22237,Can you wake me at 7 AM?,75.207565,ethnic discrimination,75.19011,What's the charge per hour?,75.18364,discouraged worker,75.183464,red bull,75.15776,null set,75.15474,ice cream,75.15437,Do you speak Spanish?,75.135765,Iron Age,75.13571,I do not believe you,75.103,autonomy,75.080444,subversion,75.0482,mouth closed,75.04657,barometer,75.0195,Which church do you belong to?,75.013214,orbit,75.00844,bird of prey,75.00676,You have not turned in your paper to me yet.,75.00041,tax avoidance,74.97084,How old were you when you became deaf?,74.96948,What's the best way to the station?,74.93684,environmental impact,74.92372,ambiguous,74.92225,impudent,74.87217
slice_128_160.npy,coffee cup,85.996445,coffee spoon,84.75879,cup of coffee,84.024956,coffee grinder,83.41776,bridesmaids,81.90959,coffee machine,80.15013,champagne,79.56593,cupid,79.132324,black coffee,79.12941,bridegroom,77.91312,Would you like a glass of wine?,77.65536,coffee pot,77.38904,"Beer, juice, lemonade, a cup of coffee or tea?",77.02751,cup of tea,76.84476,Do you want a beer?,76.63908,private eye,76.37546,microphone,75.63196,compass,75.4048,courtesy,75.403564,coffee break,75.27535,itch,74.94967,teacup,74.89684,annelid,74.8116,braid,74.75906,faithful,74.73028,red tea,74.70097,tank,74.602325,obedient,74.54944,escort,74.52572,hand-held,74.46468,Ask me!,74.19698,detective,74.19661,ashtray,74.12785,major,73.96294,obedience,73.95778,I want a small milk.,73.883606,bunny rabbit,73.72614,I will have a half cup of coffee.,73.51968,hey tedder,73.49322,white tea,73.46682,I am sorry.,73.39931,romantic,73.38727,coffee filter,73.35275,Anything for dessert?,73.18209,Very interesting.,73.13828,Give me a hug.,73.07427,Pardon?,73.03463,by a hair,73.01834,island,72.92111,craft cider,72.920876,capillary,72.86695,manipulate,72.7866,mulled wine,72.730156,goat,72.606895,I would like dessert.,72.60348,magnifying glass,72.59944,Are you a member of the church?,72.59119,somehow,72.58528,Are you thirsty?,72.51537,I like chocolate.,72.50247,automobile industry,72.484535,Harry Potter,72.47748,teaspoon,72.44705,Please tell me.,72.38075,Little My,72.35334,year,72.349106,It's itching.,72.27539,How would you like it?,72.27085,embroidery,72.24575,bodyguard,72.19418,I have a sore throat.,72.15134,Do you have a quarter?,72.144226,I love my new sidekick.,72.135475,sincere,72.13221,Answer me!,72.108,troublesome,72.09314,Ruby,72.08508,I am a doctor.,72.04171,teabagging,72.03368,cataract,72.025986,I am an police officer.,71.91688,Give me a kiss.,71.88426,custard apple,71.86306,I speak a little bit.,71.841125,hair-raising,71.82763,soft drink,71.81456,My name is..,71.76315,catabolism,71.74051,Do you have a car?,71.702515,goat cheese,71.68012,area,71.652405,annual,71.63477,straight,71.632706,captivate,71.61026,Adam's apple,71.60796,flatiron for hair,71.60054,I will take that tie.,71.56255,hair ribbon,71.540276,The Little Mermaid,71.47005,security guard,71.46335
