slice_256_288.npy,center stand,75.52884,trip,75.33111,generally speaking,75.26451,stand mixer,74.98537,deep,74.92042,mid-span,74.77324,Northwest Passage,74.75555,spin,74.40682,flip turn,74.384445,Northeast Passage,74.383804,drop-in centre,74.26764,floating,74.14072,Would you like to dance?,73.983246,sociable,73.95874,somersault to the back,73.94379,overbet,73.89707,How long are you going to stay here?,73.82233,study area,73.79251,rotation,73.65642,spinning,73.65115,deeply,73.48328,limited,73.40932,hippopotamus,73.30206,skipping,73.19652,therefore,73.157425,"Please, undress down to the waist.",73.1167,advanced depth specialised,73.029274,long-term sicklisted,72.968796,ambulatory,72.92529,turning,72.83236,mixture,72.79875,How long are you staying?,72.79657,yoga,72.788345,Take your temperature.,72.74887,hopscotch,72.74342,centre of gravity,72.72425,specialize,72.69888,garage,72.663345,clinical thermometer,72.63649,She'd like to go skateboarding.,72.63112,heimlich maneuver,72.57328,overloaded,72.54675,What is your pet's name?,72.49616,The waterfall is beautiful.,72.48567,Greenwich time,72.46831,mixer,72.45939,blender,72.438614,mid,72.392365,labyrinth,72.31836,balance weight,72.31682,somersault,72.294914,tippex,72.22429,reversion,72.16077,lay person,72.14355,standing wave,72.14307,The temperature is below zero.,72.08498,rotate,72.08244,turn,72.05235,quarter,72.043,eternal life,72.00611,hippy,71.97761,triptych,71.97558,alcohol dependence,71.96404,sitz bath,71.95203,balance disorder,71.9458,touring centre,71.9167,neighborhood,71.862366,neighbourhood (mathematics),71.85015,aerial perspective,71.844574,day-care center,71.808426,center circle,71.805336,disciplined,71.747894,parboil,71.73433,heredity,71.73334,then,71.712685,orientation,71.70879,long-term,71.69514,middle course,71.64949,paralyze,71.64295,flow rate,71.64284,perpetual,71.615585,"Take me there, please.",71.61358,"Can you weigh this parcel, please?",71.61097,grading scale,71.56087,elevated temperature,71.54175,life cycle,71.5345,survival rate,71.53147,When would you like to go?,71.504395,backslide,71.49826,lifetime,71.433,dine,71.429985,community care service,71.42297,floating jetty,71.42092,proper,71.39374,overload,71.39046,childhood,71.38287,study trip,71.3591,progression,71.35268,polysemy,71.350006,dancing,71.34267
slice_288_320.npy,community care,78.02485,wrap up warm,77.061584,I will have coffee after I eat.,76.98506,What is your sign in sign language?,76.88629,I am studying to be an interpreter.,76.593185,What´s your sign?,76.3595,sign language training for parents,76.165,"Excuse me, could you tell me the way to the station, please?",75.95619,sign language development,75.934364,digestion,75.90534,What does it eat?,75.889046,sign language user,75.7973,How do you sign?,75.75009,user interface,75.746735,You have a big alcohol problem.,75.70841,oral rehydration therapy,75.706184,I can't move my hand.,75.69667,withdrawal symptom,75.682594,blood analyser machine,75.66931,Do you want me to interpret the sermon?,75.61374,community residential facility,75.60496,beauty consultant,75.58833,Will you be dining in today?,75.55017,Do you know basic first aid?,75.52855,Can you read lips?,75.46334,community care service,75.463326,No talking during the test.,75.45032,How are you feeling?,75.449875,performance appraisal interview,75.36324,sign-to-voice interpreting,75.35707,I don't feel like eating.,75.299225,The baby is cute.,75.27384,feminine sign,75.222176,care institution,75.21076,What is your pet's name?,75.18599,sign language interpreter,75.15193,My internet connection is slow.,75.149475,incest,75.1438,geriatric home care,75.1111,residential care home,75.09967,I am not so good in your sign language,75.09891,How do you feel?,75.080986,complaints procedure,75.08019,blood relative,74.981834,generally speaking,74.96897,Breakfast is not served after 11 am,74.90427,Could you recommend me a good oculist?,74.866165,essentially,74.86142,cost-benefit analysis,74.86134,What's your social security number?,74.85106,In summer I like to go swimming.,74.83345,amnesty,74.828064,sign language structure,74.793045,What kind of job do you do?,74.77116,treatment home,74.74761,performance review interview,74.7175,How did you get interested in signing?,74.71052,Where are your boyfriend?,74.70724,How old were you when you became deaf?,74.69762,speech and language therapy,74.65602,birth parent,74.62758,social adjustment,74.6224,roll feeder,74.61357,Can I offer you anything to eat?,74.59531,I am studying to be a network engineer.,74.58861,sign formation,74.55588,virtual economy,74.44877,You mustn't eat anything.,74.41932,fruit juice,74.41469,manufacturing process,74.37806,community health care,74.34622,Many deaf students enter hearing colleges.,74.33553,Should you drink so much beer when playing poker?,74.33289,processing,74.2993,mouth ulcer,74.2814,Your girlfriend look nice.,74.27882,social economy,74.258,baby swim,74.255424,Do you have interpreted services?,74.25349,barefoot sensory path,74.21568,work-life balance,74.20709,feeling,74.20064,construction technique,74.17859,intoxication,74.17766,Joan doesn´t understand french sign language,74.159584,social comparison,74.15367,Let's you and i go to a restaurant.,74.15009,housing service,74.138336,Were any bones broken?,74.11746,Could you recommend me a good pediatrician?,74.10586,sensory impairment,74.10511,I need to balance my checkbook.,74.10498,What kind of work do you do?,74.09367,sustainable development,74.072716,community care worker,74.06943,Could you recommend me a good dermatologist?,74.057785,synthetic fibre,74.05545,community facility,74.05379,somehow,74.04722,Could you give me an advice?,74.04504
slice_320_352.npy,What time does the bus arrive?,80.92569,You have a big alcohol problem.,80.50595,How long are you going to stay here?,79.951416,With or without onions?,79.83579,What time does the train leave?,79.710785,Can you wake me at 7 AM?,79.579475,measuring time,79.47661,How long would you like to stay at our hotel?,79.29684,You must follow a diet.,78.979614,what’s the matter with you?,78.90444,How long are you staying?,78.71083,"Could you give me a call at 7 tomorrow morning, please?",78.65975,What time is it?,78.59534,probationary period,78.583954,How long do you want to stay here?,78.565796,"Yesterday, I practiced my signs.",78.53531,How old were you when you became deaf?,78.495995,Have you got a single room for tonight?,78.369995,It is a constant pain.,78.29725,When were you born?,78.274994,From what time is it open?,78.22702,What's the charge per hour?,78.17031,How did you become deaf?,78.146835,Where does Sunday School meet?,78.06905,How long will it take?,78.052635,How long does the train stop here?,78.03881,impulsive,77.77995,I got an email from my mother today.,77.76011,Where does this train go?,77.718475,On Saturdays I have to cook for the family,77.577736,Would you be so kind  and keep the seat for me?,77.57657,painless,77.5047,reaction time,77.40659,When you have been absent you must bring an excuse.,77.40579,Is there anything else I can do for you?,77.362785,temporarily unavailable,77.34785,How have you been?,77.30161,Where does it hurt?,77.2619,What's wrong with you?,77.19101,May I offer you a drink?,77.15413,Where were you born?,77.1425,Where is the station?,77.10788,You mustn't eat anything.,77.06408,What time do the shops close?,77.03537,"Lovely day today, isn't it?",77.0173,What times are the services?,77.00256,Can you change the tyre for me?,76.98805,Breakfast is not served after 11 am,76.95909,Trick Or Treat?,76.95396,Who do you want to talk to?,76.947075,How long must we wait there?,76.87689,I should be off now.,76.871475,"First of all, I have to examine your eyes.",76.8612,diet therapy,76.86077,Stop here on red.,76.859344,"Excuse me, could you tell me the way to the station, please?",76.857,Where are your boyfriend?,76.842545,May I go with you?,76.83915,measuring error,76.8217,I am sorry to bother you.,76.80588,non-metal,76.80427,alcohol abuse,76.77225,Do you have time for me?,76.767166,Do you want a diet or regular drink?,76.76535,"Would you call me a cab, please?",76.76082,"Where can I get tickets, please?",76.747604,How did you get interested in signing?,76.69839,yellow tomato,76.6963,single-breadwinner family,76.690544,probation supervision case,76.67997,He has an internal injury.,76.67258,Where is the next bus stop?,76.65861,Where is an exchange office?,76.65761,When does the match begin?,76.64909,I will have coffee after I eat.,76.64286,When do you serve breakfast?,76.64084,Can I offer you anything to drink?,76.60517,When do you open?,76.56693,Is there a restauratnt car on the train?,76.53496,With or without pickles?,76.51177,Have you got any change?,76.51025,No talking during the test.,76.50341,What is the date today?,76.48638,We must pay taxes to support the government.,76.4783,metal forming,76.46599,What is the temperature?,76.46196,reasonable time,76.456665,metal fatigue,76.41337,Do you have a boy friend?,76.40169,alcoholise,76.38849,What's the best way to the station?,76.35841,It takes about 10 minutes by bus.,76.35716,Can I offer you anything to eat?,76.354706,individual work,76.32172,How do you sign?,76.31652,Where do you come from?,76.28776,electrically operated antenna,76.280655,When does school start?,76.28013,"Sorry, we're fully booked for tonight.",76.27975,illegal restraint,76.27705
slice_352_384.npy,daylight savings time,78.39199,kilometre per hour,78.11542,What's your occupation?,77.60545,What is the temperature?,77.14618,How did you become deaf?,77.007706,How old were you when you became deaf?,76.85981,What is your name?,76.12181,What time is it?,76.10622,What times are the services?,76.08702,What´s your name?,76.0711,half an hour,75.940315,The temperature is below zero.,75.82487,time keeper sports,75.77475,What's the charge per hour?,75.74927,What's your surname?,75.740364,Where were you born?,75.72013,Which church do you belong to?,75.62846,Where do you work?,75.48335,kitchen timer,75.41499,When were you born?,75.401474,individual counseling for unemployed,75.380104,lonely,75.36798,How long are you staying?,75.31551,What's your social security number?,75.3152,What is your pet's name?,75.27922,reasonable time,75.236046,Bronze Age,75.227036,individual work,75.16125,I am a secretary.,75.14749,standard time,75.12631,minor (law),75.074814,I am single.,75.07405,When does school start?,75.03413,the principle of public access to official documents,74.99119,Where is the restroom?,74.97841,Where are you from?,74.97794,Time is up.,74.95992,What kind of work do you do?,74.90016,Where does this train go?,74.855095,Where do you come from?,74.84179,additional hours,74.82504,Where is the station?,74.8176,probationary period,74.7648,Where do you live?,74.75725,community service officer,74.75328,It's a 10 minutes walk.,74.74567,What time does the train leave?,74.64859,When do you open?,74.627716,Where is the teater?,74.59534,Who do you want to talk to?,74.59238,Are you a member of the church?,74.568954,time for consideration,74.55016,What kind of job do you do?,74.54621,personality type,74.52691,measuring time,74.44195,single-parent family,74.42123,professional secrecy,74.39865,individual development,74.28815,How long will it take?,74.28757,lay person,74.27991,Greenwich time,74.22445,continuous dryer,74.194466,simple pendulum,74.147766,single supplement,74.13976,Where is an exchange office?,74.097496,What are the benefits?,74.086464,Who are you?,74.06299,Where is my calculator?,74.02752,incubation period,73.97545,When?,73.924355,How much is it per night?,73.92008,puberty,73.90801,I go to church every Sunday.,73.89901,punctual,73.880165,What kind of tree is this?,73.86921,elevated temperature,73.866776,Are you a Christian?,73.834526,What kind of service do you have?,73.802986,leisure-time centre,73.79808,adverbial cluse of time,73.7892,community care service,73.772896,day bed,73.77074,What time does the post office close?,73.76557,My mother works as a clerk in an office.,73.75027,Who are you waiting for?,73.71263,legislation,73.70694,mature,73.697205,work stress,73.696556,What is your adress?,73.69332,Where does Sunday School meet?,73.6718,What is the church address?,73.66511,It's time to take your temperature.,73.62584,child in care,73.60346,person on duty,73.59889,child care provider,73.59682,plumber,73.587006,Where to?,73.57895,compulsory school age,73.55857,community care worker,73.55817,Have you got a fever?,73.55752
slice_384_416.npy,between,82.11479,hand specimen,78.94088,share,77.59248,lesson,77.56755,primary school,77.1806,Could you show me?,76.799675,Wash your hands.,76.41152,His niece will help you.,76.3073,median,76.2384,Do you have your ticket?,76.15884,nursery school,76.09893,I have been waiting 20 minutes.,76.09137,Little My,75.9985,sample,75.90442,I can't feel his pulse.,75.83683,Could you give me an advice?,75.78134,thesaurus,75.68941,B movie,75.5893,I need your help.,75.58402,representation,75.49831,heart rate monitor,75.4539,minute,75.39397,periodical,75.35394,career guidance,75.29333,I need a specimen of your stool.,75.23095,May I help you?,75.20311,magazine,75.16266,part,75.154,Can l help you?,75.15271,handbook,75.14454,elementary school,75.01681,Close your book.,74.96395,May I see your ticket please?,74.91436,How do you sign?,74.90438,Have you been baptized?,74.83608,share (finance),74.83001,In two weeks,74.81365,bother,74.768585,school attendance,74.75796,Can I help you?,74.72549,Would you like a magazine or newspaper?,74.698715,wood,74.680336,range,74.54807,poetry,74.51357,heartbeat,74.420685,How can I help you?,74.39697,literature,74.34771,probation,74.34013,neighbourhood (mathematics),74.223465,Whose book is it?,74.208824,I need a specimen of your blood.,74.18227,I appreciate your help.,74.15989,microfiche reader,74.10886,Do you have any aspirin?,74.10345,book video,74.06358,Do you have a pet?,73.99016,Please wait.,73.96529,candle lantern,73.93892,kitchen timer,73.900314,chisel,73.87007,heart monitor,73.86024,career counselling,73.85774,butterfly,73.833206,baby sister,73.8327,When does school start?,73.82299,literacy,73.82213,In five weeks,73.81308,Have you got a fever?,73.79159,cheese grater,73.78155,plant marker,73.75812,Have you bought your ticket?,73.74884,minutes,73.739624,hand cream,73.73064,Do you have interpreted services?,73.727005,poppy,73.713936,micrometer,73.70316,moment,73.67633,"May I have a menu, please?",73.67411,Help me stop bleeding.,73.67207,counselling,73.67078,Are you alright?,73.615944,"Hello, can I help you?",73.61316,pulse,73.609146,sailing,73.53683,Please help me.,73.50522,What are your symptoms?,73.49122,half an hour,73.46835,Do you go to school?,73.45596,The Groke,73.44636,spiral binder,73.42213,What´s your sign?,73.401886,dongle,73.38332,near,73.37987,braille,73.37023,In three weeks,73.36967,My Little Pony,73.35564,technique,73.34279,heart attack,73.3255,minor (law),73.24922,What is your sign in sign language?,73.21898
slice_416_448.npy,straw purchase,82.46711,"First of all, I have to examine your eyes.",81.12683,birth control pills,80.796555,bamboo tomato stake,80.371414,May I see your ticket please?,79.88902,plant marker,79.71414,hand specimen,79.452095,Is this first time you've had this?,79.330345,I want you to use a condom.,79.17115,plant entrance,79.13967,oral examination,79.13063,What's the charge per hour?,79.01079,When does the match begin?,78.97428,simple lipid,78.96141,I will see you next Monday.,78.70956,plant costs,78.7049,I need a specimen of your stool.,78.68774,What does it eat?,78.644485,deaf humour,78.55446,Can you change the tyre for me?,78.52491,Can you read lips?,78.45017,barcode reader,78.31511,Have you bought your ticket?,78.227806,to attest,78.18463,Can I offer you anything to eat?,78.145386,one colour offset printing machine,78.14328,primary need,77.97141,mousetrap,77.69791,random sample,77.69002,urine specimen collection cup,77.661285,plant stalk,77.469025,Is breakfast included?,77.40368,hay tedder,77.37909,witch,77.34429,dog bite,77.33021,Stop here on red.,77.22709,stop codon,77.22507,Do you have any aspirin?,77.224396,handicrafts magazine,77.21287,When does school start?,77.196434,I was Born in 1960.,77.16304,Would you like a magazine or newspaper?,77.15495,"It must have been 2 months, 3 months since we lost the dog.",77.130585,housing adjusting grant,77.091095,expired food,76.996544,Have you ever had a tooth pulled?,76.99653,speech therapist,76.88374,herbicide,76.868095,beeswax candle,76.8173,Did you receive a notification to appear in court?,76.79305,sign language dictionary,76.730484,mouth closed,76.70123,specimen sample,76.67517,You have not turned in your paper to me yet.,76.66066,"Do you want mustard, mayo, or both?",76.65661,condom,76.65119,Is the dinner included?,76.63707,test tube fertilization,76.61598,probation centre,76.60355,collusion at an auction,76.5896,When were you born?,76.52573,riddle,76.51576,python,76.511475,contraceptive pill,76.48399,I graduate in two years.,76.48325,"May I have a menu, please?",76.47708,diving pharmacy,76.4608,case review,76.33699,bird cherry,76.33652,Can l help you?,76.33046,rapeseed oil,76.32929,Did you see the woman?,76.30107,kitchen assistant,76.24429,new testament,76.22876,Can I offer you anything to drink?,76.21726,I will have coffee after I eat.,76.195114,What are these charges for?,76.1823,design brief,76.06223,mock up,76.057045,Have you got any change?,76.05275,kitchen sink,76.01197,withdrawal symptom,76.01066,tax revenue,76.00778,yearbook,75.99702,Could you show me?,75.985596,baby sister,75.97505,Can you get this stain out?,75.96596,embryo,75.948586,Is there a guarantee on this?,75.9483,tax return,75.929726,geriatric home care,75.86381,kitchen timer,75.85592,Do you have your ticket?,75.854836,the small blind,75.84784,When does it close?,75.80838,We have a test tomorrow.,75.794556,May I have you business card?,75.76971,popcorn,75.73404,oral sex,75.70395,How did you get interested in signing?,75.67076
slice_448_480.npy,From what time is it open?,87.66977,How much does the book cost?,87.289474,What salad dressing would you like?,86.76608,What sport facilities are there here?,86.623474,What are today's specials?,85.84891,What is the date today?,85.70317,What time do the shops close?,85.349976,When does it open?,85.156815,How did it happen?,85.09335,What time does the bus arrive?,84.79763,When does the match begin?,84.11996,What are the benefits?,83.87822,What time is it?,83.73355,What happened to you?,83.61391,What happened?,83.22284,What is the soup of the day?,83.217384,How much does the position pay?,83.17386,"Lovely day today, isn't it?",83.09324,Where are there a lot of restaurants?,83.05788,Where do I buy tickets?,82.952415,How much is it?,82.74167,How long will it take?,82.6967,What time does the post office close?,82.49637,What shall l do?,82.4315,Is there anywhere a big department store?,82.24772,How much does it cost?,82.24737,How long must we wait there?,82.19701,How much is a room for two people?,82.194534,How long do you want to stay here?,82.14904,How many children do you have?,82.04909,"Where can I get tickets, please?",82.03493,What times are the services?,82.0108,When does it close?,82.005554,Where is a waiting room?,82.000404,The booking tickets office is open.,81.97685,When do you open?,81.94586,How much will the repair cost?,81.80741,When does school start?,81.787315,What  is happening?,81.76537,What now?,81.72727,How much?,81.59717,How long would you like to stay at our hotel?,81.57084,I should be off now.,81.48406,How would you like it?,81.475,Parking is free here.,81.31622,How much is a ticket to _____?,81.31029,When is the next lesson?,81.29498,How much does he owe?,81.26828,How many?,81.22682,How long are you going to stay here?,81.12443,Which city is the capital?,81.0367,How much does it cost to get in?,81.033485,No appointments today.,81.03314,How have you been?,80.94536,May I closed the window?,80.901344,What's the name of this street?,80.83461,Do you have plans for Labor Day?,80.7858,Parking is not allowed here.,80.78358,trade book,80.745224,How many dioptres do you have?,80.716515,What's the score?,80.71481,general eligibility,80.674355,what’s the matter with you?,80.578316,Will we play at the same table?,80.57409,Where does it hurt?,80.50903,Where is the next bus stop?,80.49999,May I have another piece?,80.48932,Where is the cash register?,80.44761,What's the best way to the station?,80.4312,May I open the window?,80.317085,sales material,80.277054,Who is the new president?,80.257126,opportunity cost,80.242615,I got a new computer for my birthday.,80.213486,specialist's book,80.18983,Whose book is it?,80.15368,Where does Sunday School meet?,80.15299,What can l do for you?,80.15234,The next day,80.1452,Have you bought your ticket?,80.14102,Open your book.,80.140045,When would you like to go?,80.10043,Is there a children's menu?,80.083496,Where is the main post offfice?,80.08067,How many children are coming?,80.05516,What does it eat?,80.029144,Where are the dressing rooms?,79.97438,invitation card,79.89913,freedom of the press,79.89638,What's the matter?,79.86497,gross national product,79.776276,When will we meet?,79.76869,What is the church address?,79.70039,I think there is a mistake in the bill.,79.695694,How much did you pay?,79.6791,vital event,79.66698,May I see the room first?,79.63907,What kind of service do you have?,79.6157,performance-related pay,79.55255,What is the temperature?,79.513885
